{
  "$schema": "https://json-schema.org/draft/2020-12/schema",
  "$id": "https://github.com/yujianwudi/ai-image-prompts/blob/main/配置/prompt_packs.schema.json",
  "title": "AI Image Prompt Pack Configuration",
  "description": "Schema for machine-readable Prompt as Code packs used by this repository.",
  "type": "object",
  "required": [
    "$schema",
    "version",
    "description",
    "characters",
    "templates",
    "packs",
    "global_quality_constraints"
  ],
  "additionalProperties": false,
  "properties": {
    "$schema": {
      "type": "string"
    },
    "version": {
      "type": "string",
      "minLength": 1
    },
    "description": {
      "type": "string",
      "minLength": 1
    },
    "characters": {
      "type": "object",
      "minProperties": 1,
      "additionalProperties": {
        "$ref": "#/$defs/character"
      }
    },
    "templates": {
      "type": "object",
      "minProperties": 1,
      "additionalProperties": {
        "$ref": "#/$defs/template"
      }
    },
    "packs": {
      "type": "array",
      "minItems": 1,
      "items": {
        "$ref": "#/$defs/pack"
      }
    },
    "global_quality_constraints": {
      "type": "array",
      "minItems": 1,
      "items": {
        "type": "string",
        "minLength": 1
      }
    }
  },
  "$defs": {
    "string_list": {
      "type": "array",
      "minItems": 1,
      "items": {
        "type": "string",
        "minLength": 1
      }
    },
    "character": {
      "type": "object",
      "required": [
        "display_name",
        "anchor",
        "must_keep",
        "avoid"
      ],
      "additionalProperties": false,
      "properties": {
        "display_name": {
          "type": "string",
          "minLength": 1
        },
        "anchor": {
          "type": "string",
          "minLength": 1
        },
        "must_keep": {
          "$ref": "#/$defs/string_list"
        },
        "avoid": {
          "$ref": "#/$defs/string_list"
        }
      }
    },
    "template": {
      "type": "object",
      "required": [
        "task_type",
        "tags",
        "composition",
        "lighting",
        "material",
        "text_strategy",
        "safety"
      ],
      "additionalProperties": false,
      "properties": {
        "task_type": {
          "type": "string",
          "minLength": 1
        },
        "tags": {
          "$ref": "#/$defs/string_list"
        },
        "composition": {
          "type": "string",
          "minLength": 1
        },
        "lighting": {
          "type": "string",
          "minLength": 1
        },
        "material": {
          "type": "string",
          "minLength": 1
        },
        "text_strategy": {
          "type": "string",
          "minLength": 1
        },
        "safety": {
          "type": "string",
          "minLength": 1
        }
      }
    },
    "pack": {
      "type": "object",
      "required": [
        "id",
        "title",
        "character",
        "template",
        "scene",
        "action",
        "extra_constraints"
      ],
      "additionalProperties": false,
      "properties": {
        "id": {
          "type": "string",
          "pattern": "^[a-z0-9_]+$"
        },
        "title": {
          "type": "string",
          "minLength": 1
        },
        "character": {
          "type": "string",
          "minLength": 1
        },
        "template": {
          "type": "string",
          "minLength": 1
        },
        "scene": {
          "type": "string",
          "minLength": 1
        },
        "action": {
          "type": "string",
          "minLength": 1
        },
        "extra_constraints": {
          "$ref": "#/$defs/string_list"
        }
      }
    }
  }
}
