{
  "$schema": "prompt_packs.schema.json",
  "version": "2026-06-10-gpt-image-2-web-optimized",
  "description": "机器可读 Prompt Pack：按 gpt-image-2 联网复核后的自然语言结构，把角色锚点、输出用途、场景、构图、光线、材质、文字策略和约束拆成可组合字段。",
  "characters": {
    "furina": {
      "display_name": "芙宁娜 Furina",
      "anchor": "芙宁娜 Furina cosplay，白色短发带浅蓝色挑染，小巧蓝黑色礼帽，枫丹蓝白贵族歌剧服，自信俏皮、优雅戏剧化，像舞台演员被朋友随手拍到的真实 coser。",
      "must_keep": [
        "白蓝短发",
        "蓝黑小礼帽",
        "枫丹蓝白贵族歌剧服",
        "金色纽扣与水滴宝石",
        "自信俏皮的戏剧化气质"
      ],
      "avoid": [
        "茜特菈莉的粉紫长发和黑紫纳塔萨满服",
        "多莉的方形眼镜和紫金商人帽",
        "普通蓝白公主裙",
        "低俗或性感化姿势"
      ]
    },
    "citlali": {
      "display_name": "茜特菈莉 Citlali",
      "anchor": "茜特菈莉 Citlali cosplay，淡粉紫色长发，前侧细长辫，黑紫纳塔夜神部落萨满服，冷淡安静、神秘傲娇，像被朋友喊住后不太情愿回头的真实 coser。",
      "must_keep": [
        "粉紫长发",
        "前侧细辫",
        "黑紫纳塔萨满服",
        "蓝紫冷色眼睛",
        "冷淡神秘傲娇气质"
      ],
      "avoid": [
        "芙宁娜的白蓝短发、蓝黑礼帽和枫丹歌剧服",
        "多莉的方形眼镜、金币和紫金商人帽",
        "蓝白贵族歌剧风",
        "低俗或性感化姿势"
      ]
    },
    "dori": {
      "display_name": "多莉 Dori",
      "anchor": "多莉 Dori cosplay，小个子成年 coser，粉色卷发，方形小眼镜，紫金大商人帽，须弥商人风格，机灵爱财、笑眯眯但安全可爱的真实 coser。",
      "must_keep": [
        "小个子成年 coser",
        "粉色卷发",
        "方形小眼镜",
        "紫金大商人帽",
        "金币钱袋、小灯壶和须弥商人道具",
        "机灵爱财气质"
      ],
      "avoid": [
        "芙宁娜的白蓝短发、蓝黑礼帽和枫丹歌剧服",
        "茜特菈莉的粉紫长直发、前侧细辫和黑紫萨满服",
        "儿童化或性感化",
        "低俗擦边姿势"
      ]
    }
  },
  "templates": {
    "realistic_convention_phone": {
      "task_type": "写实 cos 手机随手拍",
      "tags": [
        "写实cos",
        "手机随手拍",
        "室内漫展",
        "9:16",
        "无文字",
        "公开安全"
      ],
      "composition": "9:16 竖图，写实手机照片，普通观众视角，手持手机随手拍，主体半身或三分之二身清晰，背景有真实漫展现场感并轻微虚化。",
      "lighting": "室内展馆自然顶灯或摊位柔光，脸部曝光自然，眼睛有轻微高光，服装颜色不跑偏。",
      "material": "真实可穿戴 cosplay 质感：布料纹理、缝线、刺绣、金属扣、宝石、皮革、发丝和手部道具细节。",
      "text_strategy": "不需要画面文字，不要水印、logo、乱码或随机英文。",
      "safety": "端庄自然，非低俗，不性感化，不暴露化，不卧室暧昧感，不插画风，不CG渲染。"
    },
    "readme_preview": {
      "task_type": "GitHub README 公开预览图",
      "tags": [
        "README预览",
        "公开展示",
        "写实手机照片",
        "9:16",
        "无文字",
        "公开安全"
      ],
      "composition": "9:16 竖图，写实手机照片，画面干净明亮，主体半身或三分之二身清晰，角色服装和配件可辨认，背景有展示感但不杂乱。",
      "lighting": "柔和自然光或室内暖光，脸部清楚，整体适合公开 README 展示。",
      "material": "真实服装材质，布料褶皱、缝线、刺绣、宝石、金属饰件和发丝细节可见。",
      "text_strategy": "不需要画面文字；不要水印、logo、乱码、随机英文或真实平台标识。",
      "safety": "必须适合公开 README 展示，非低俗，不性感化，不擦边，不卧室暧昧感。"
    },
    "character_card": {
      "task_type": "角色参考卡",
      "tags": [
        "角色参考卡",
        "多区域",
        "一致性检查",
        "短中文标签",
        "公开安全"
      ],
      "composition": "清晰分区：主视觉半身图、全身站姿、头饰特写、服装细节、道具特写和气质标签；所有区域保持同一角色。",
      "lighting": "干净均匀的设定图光线，发型、头饰、服装和道具细节可辨认。",
      "material": "所有局部细节与主图一致，服装、头饰、道具材质真实，不要塑料玩具感。",
      "text_strategy": "只使用少量短中文标签，例如“头饰”“发型”“刺绣”“道具”；文字清晰可读，不要乱码、水印或真实平台 logo。",
      "safety": "端庄自然，非低俗，不性感化。所有区域保持同一角色，不混入其他角色。"
    },
    "commercial_poster": {
      "task_type": "商业联名海报 / 电商主图",
      "tags": [
        "商业海报",
        "电商主图",
        "短标题",
        "9:16",
        "公开安全",
        "无真实品牌"
      ],
      "composition": "9:16 竖版商业联名海报，主体居中，前景少量主题道具，中景展示角色，背景是主题装饰和柔和氛围光，预留标题区域。",
      "lighting": "柔和商业布光，层次清楚，主体从背景中分离，但保留写实 cosplay 质感。",
      "material": "真实服装质感、道具材质、包装或海报纸面质感，避免塑料玩具感。",
      "text_strategy": "可预留短标题区；若生成文字，只允许短中文标题，清晰可读，不要乱码、随机英文、水印或真实品牌 logo。",
      "safety": "端庄自然，非低俗，不性感化，不使用真实品牌 logo，不擦边。"
    },
    "vertical_thumbnail": {
      "task_type": "竖版社媒封面缩略图",
      "tags": [
        "封面缩略图",
        "社媒封面",
        "短标题",
        "9:16",
        "公开安全"
      ],
      "composition": "9:16 竖版封面缩略图，上方短标题区，中间角色半身或三分之二身，下方 2-3 个短标签卡片；主体清楚，背景有层次但不抢主体。",
      "lighting": "明亮清楚，有对比但不过度商业硬光，角色和文字区都易读。",
      "material": "角色服装真实，背景干净，有轻微现场感或主题装饰。",
      "text_strategy": "短标题不超过 8 个字，标签不超过 4 个字，文字清晰可读；不要乱码、水印、随机英文或真实平台 logo。",
      "safety": "端庄自然，非低俗，不性感化，不标题党，不擦边。"
    }
  },
  "packs": [
    {
      "id": "furina_convention_phone",
      "title": "芙宁娜室内漫展手机随手拍",
      "character": "furina",
      "template": "realistic_convention_phone",
      "scene": "室内漫展通道，背景有人群、展位灯牌、海报墙和轻微玻璃反光。",
      "action": "她微微侧身看向镜头，表情自信、俏皮，像朋友刚好喊她回头。",
      "extra_constraints": [
        "不要把短发变成长发",
        "不要把礼帽换成商人帽或萨满头饰"
      ]
    },
    {
      "id": "furina_readme_preview",
      "title": "芙宁娜 README 公开预览图",
      "character": "furina",
      "template": "readme_preview",
      "scene": "明亮甜品店或展馆休息区，背景干净，有浅色桌面和柔和装饰。",
      "action": "她坐在桌边轻轻托着甜点盘，保持优雅又俏皮的表情。",
      "extra_constraints": [
        "画面适合公开仓库展示",
        "不要卧室暧昧感"
      ]
    },
    {
      "id": "furina_character_card",
      "title": "芙宁娜角色参考卡",
      "character": "furina",
      "template": "character_card",
      "scene": "简洁浅蓝白设定页背景，带少量水滴、金色线条和歌剧舞台纹样。",
      "action": "主视觉是自信微笑的半身图，细节区展示蓝黑礼帽、白蓝短发、领结、金色纽扣、水滴宝石和手套。",
      "extra_constraints": [
        "所有分区都是同一个芙宁娜",
        "不要出现茜特菈莉的细辫或多莉的方形眼镜"
      ]
    },
    {
      "id": "furina_commercial_poster",
      "title": "芙宁娜枫丹甜品联名海报",
      "character": "furina",
      "template": "commercial_poster",
      "scene": "枫丹歌剧院风甜品联名视觉，前景有蓝白甜点、透明杯、金色小托盘和水滴装饰，不出现真实品牌 logo。",
      "action": "她优雅地拿着甜点盘，表情自信俏皮，像活动主视觉里的真实 coser。",
      "extra_constraints": [
        "标题区保持干净",
        "不要把贵族歌剧服改成普通公主裙"
      ]
    },
    {
      "id": "furina_vertical_thumbnail",
      "title": "芙宁娜角色防串教程封面",
      "character": "furina",
      "template": "vertical_thumbnail",
      "scene": "蓝白渐变背景，点缀少量水滴、金色装饰线和舞台帷幕元素。",
      "action": "她站在画面中间偏右，微微抬头看向镜头，左上方预留短标题区。",
      "extra_constraints": [
        "标题建议：芙宁娜防串",
        "保留蓝黑小礼帽和白蓝短发"
      ]
    },
    {
      "id": "citlali_convention_phone",
      "title": "茜特菈莉室内漫展手机随手拍",
      "character": "citlali",
      "template": "realistic_convention_phone",
      "scene": "室内漫展展馆休息区，背景有黑紫色灯牌、展位边缘、路人和轻微虚化的海报墙。",
      "action": "她被朋友喊住后轻轻回头，表情冷淡安静，有点不情愿但不阴暗。",
      "extra_constraints": [
        "不要把长发变成白蓝短发",
        "不要戴芙宁娜礼帽或多莉商人帽"
      ]
    },
    {
      "id": "citlali_readme_preview",
      "title": "茜特菈莉 README 公开预览图",
      "character": "citlali",
      "template": "readme_preview",
      "scene": "干净明亮的展馆角落或咖啡座，背景有柔和黑紫装饰和浅色桌面。",
      "action": "她安静坐在桌边，手边有小吊饰和几何纹样布料，气质神秘但画面清爽。",
      "extra_constraints": [
        "画面适合公开仓库展示",
        "不要过暗、不要恐怖感、不要擦边"
      ]
    },
    {
      "id": "citlali_character_card",
      "title": "茜特菈莉角色参考卡",
      "character": "citlali",
      "template": "character_card",
      "scene": "简洁浅灰背景，带少量黑紫和蓝紫装饰纹样。",
      "action": "主视觉是安静回头，细节区展示前侧细辫、发饰、披帛、部落纹样和小吊饰。",
      "extra_constraints": [
        "所有分区都是同一个茜特菈莉",
        "不要出现芙宁娜礼帽或多莉眼镜"
      ]
    },
    {
      "id": "citlali_commercial_poster",
      "title": "茜特菈莉夜神主题联名海报",
      "character": "citlali",
      "template": "commercial_poster",
      "scene": "夜神部落主题饰品或饮品联名视觉，前景有星点、几何纹样小卡片、紫蓝渐变杯和小吊饰，不出现真实品牌 logo。",
      "action": "她安静站在主视觉中央，手指轻轻扶着小吊饰，表情冷淡神秘。",
      "extra_constraints": [
        "商业感要克制干净",
        "不要混成枫丹贵族或须弥商人"
      ]
    },
    {
      "id": "citlali_vertical_thumbnail",
      "title": "茜特菈莉角色防串教程封面",
      "character": "citlali",
      "template": "vertical_thumbnail",
      "scene": "干净的黑紫渐变背景，点缀少量星点和几何纹样。",
      "action": "她站在画面中间偏右，冷淡看向镜头，左上方预留短标题区。",
      "extra_constraints": [
        "标题建议：角色防串",
        "文字少而清楚"
      ]
    },
    {
      "id": "dori_convention_phone",
      "title": "多莉室内漫展手机随手拍",
      "character": "dori",
      "template": "realistic_convention_phone",
      "scene": "室内漫展摊位旁，背景有小商品展示架、暖色灯牌、路人和轻微虚化的展位桌面。",
      "action": "她笑眯眯地看向镜头，一只手扶着小灯壶，一只手像在招呼朋友拍照。",
      "extra_constraints": [
        "必须是成年 coser",
        "可爱但不儿童化、不性感化"
      ]
    },
    {
      "id": "dori_readme_preview",
      "title": "多莉 README 公开预览图",
      "character": "dori",
      "template": "readme_preview",
      "scene": "明亮商场或漫展小摊位，背景有整齐的宝石道具、金币装饰和浅色桌面。",
      "action": "她站在摊位旁笑眯眯展示小灯壶，道具数量适中，整体安全可爱。",
      "extra_constraints": [
        "适合公开仓库展示",
        "不要低俗、不要儿童化、不要过度夸张道具"
      ]
    },
    {
      "id": "dori_character_card",
      "title": "多莉角色参考卡",
      "character": "dori",
      "template": "character_card",
      "scene": "简洁浅紫和金色设定页背景，带少量商人小包、金币和灯壶图标。",
      "action": "主视觉是笑眯眯半身图，细节区展示粉色卷发、方形眼镜、紫金商人帽、钱袋、小灯壶和宝石饰品。",
      "extra_constraints": [
        "所有分区都是同一个成年多莉 coser",
        "不要儿童化，不要混入芙宁娜礼帽或茜特菈莉细辫"
      ]
    },
    {
      "id": "dori_commercial_poster",
      "title": "多莉商业联名海报",
      "character": "dori",
      "template": "commercial_poster",
      "scene": "须弥风小摊位，前景有金币、宝石、钱袋和小灯壶，道具数量克制。",
      "action": "她笑眯眯地举起小灯壶，像在招呼朋友看新商品。",
      "extra_constraints": [
        "必须是成年 coser",
        "可爱但不儿童化、不性感化"
      ]
    },
    {
      "id": "dori_vertical_thumbnail",
      "title": "多莉角色防串教程封面",
      "character": "dori",
      "template": "vertical_thumbnail",
      "scene": "紫金渐变背景，点缀金币、宝石、小灯壶和简洁卡片元素。",
      "action": "她站在画面中间偏右，笑眯眯地扶着方形眼镜，左上方预留短标题区。",
      "extra_constraints": [
        "标题建议：多莉防串",
        "必须保留方形眼镜和紫金大商人帽"
      ]
    }
  ],
  "global_quality_constraints": [
    "写实自然，不插画风，不 CG 渲染，不塑料皮肤，不过度磨皮。",
    "角色发型、头饰、服装配色、关键配件和气质必须准确。",
    "不要混入其他角色设定，尤其不要把茜特菈莉或多莉混成芙宁娜。",
    "不要水印、乱码、随机英文、真实平台 logo 或真实品牌 logo。",
    "带文字图只使用短标题和短标签，文字必须清晰可读。"
  ]
}
